Metric,avg,min,max,sum,p1,p5,p10,p25,p50,p75,p90,p95,p99,std
E2E Output Token Throughput (tokens/sec/user),250.88,172.04,330.33,25087.77,172.31,194.28,211.00,226.92,251.37,276.21,294.14,302.53,327.31,34.25
HTTP Blocked (ms),0.00,0.00,0.00,0.00,0.00,0.00,0.00,0.00,0.00,0.00,0.00,0.00,0.00,0.00
HTTP Chunks Received,724.84,79.00,8941.00,72484.00,79.99,116.90,167.40,235.50,380.50,642.25,1421.50,2003.75,7141.18,1232.46
HTTP Chunks Sent,1.00,1.00,1.00,100.00,1.00,1.00,1.00,1.00,1.00,1.00,1.00,1.00,1.00,0.00
HTTP Connecting (ms),0.24,0.21,0.71,23.95,0.21,0.21,0.22,0.22,0.23,0.23,0.26,0.28,0.52,0.06
HTTP Connection Overhead (ms),0.24,0.21,1.07,24.49,0.21,0.21,0.22,0.22,0.23,0.23,0.26,0.28,0.70,0.10
HTTP Connection Reused (ratio),0.00,0.00,0.00,0.00,0.00,0.00,0.00,0.00,0.00,0.00,0.00,0.00,0.00,0.00
HTTP Data Received (KB),265.58,47.53,2364.11,26558.13,59.82,69.13,84.28,105.57,154.35,260.48,527.23,652.48,2104.98,340.58
HTTP Data Sent (KB),0.32,0.17,0.92,32.08,0.17,0.18,0.19,0.23,0.29,0.36,0.48,0.57,0.90,0.14
HTTP DNS Lookup (ms),0.01,0.00,0.36,0.53,0.00,0.00,0.00,0.00,0.00,0.00,0.00,0.00,0.17,0.04
HTTP Duration (excl. conn) (ms),4534.59,882.14,52089.04,453458.52,950.32,1306.24,1495.62,1825.32,2577.59,4014.59,7798.97,11466.54,39388.13,6879.17
HTTP Receiving (ms),4345.34,721.09,51865.51,434533.82,780.51,1143.14,1304.79,1648.38,2393.84,3807.45,7601.11,11271.17,39201.89,6871.87
HTTP Sending (ms),0.34,0.31,1.00,34.44,0.31,0.31,0.31,0.32,0.32,0.34,0.37,0.41,0.68,0.08
HTTP Total Time (ms),4534.83,882.35,52089.29,453483.01,950.55,1306.50,1495.84,1825.55,2577.82,4014.85,7799.20,11466.77,39388.35,6879.17
HTTP Waiting (TTFB) (ms),188.90,155.64,341.64,18890.25,156.21,160.63,163.55,169.85,177.00,193.98,221.46,237.97,329.42,34.82
Input Sequence Length (tokens),62.40,10.00,365.00,6240.00,11.98,17.90,20.90,27.75,46.50,71.00,110.10,162.15,363.02,58.65
Inter Chunk Latency (ms),3.97,0.00,79.64,434401.61,0.00,0.00,0.00,0.00,0.02,0.05,24.57,25.30,28.02,9.18
Inter Token Latency (ms),3.76,2.88,5.32,376.36,2.92,3.09,3.21,3.39,3.73,4.00,4.51,4.71,5.26,0.52
OSL Mismatch Diff % (%),-96.66,-99.41,-70.25,-9665.91,-99.26,-99.14,-98.95,-98.68,-98.06,-96.72,-93.35,-91.76,-73.42,4.30
Output Sequence Length (tokens),1094.75,193.00,9748.00,109475.00,243.49,281.90,343.90,432.75,634.50,1074.50,2180.50,2698.95,8709.49,1407.45
Output Token Count (tokens),1094.75,193.00,9748.00,109475.00,243.49,281.90,343.90,432.75,634.50,1074.50,2180.50,2698.95,8709.49,1407.45
Output Token Throughput Per User (tokens/sec/user),270.47,187.93,347.81,27046.75,190.17,212.30,221.72,250.18,268.27,294.87,311.16,323.92,341.94,34.79
Prefill Throughput Per User (tokens/sec/user),310.15,60.89,1101.03,31015.08,64.86,103.58,119.29,161.72,245.12,376.16,560.53,782.39,1067.37,216.15
Request Latency (ms),4533.32,882.12,52088.88,453331.56,950.34,1306.25,1495.56,1825.26,2577.62,3995.42,7798.92,11466.47,39388.00,6879.51
Time to First Output Token (ms),189.30,156.01,342.07,18929.95,156.57,161.00,164.09,170.21,177.40,194.38,222.19,238.36,329.81,34.84
Time to First Token (ms),189.30,156.01,342.07,18929.95,156.57,161.00,164.09,170.21,177.40,194.38,222.19,238.36,329.81,34.84
Time to Second Token (ms),27.43,25.38,79.64,2743.26,25.52,25.64,25.80,26.24,26.73,27.33,28.41,29.13,31.54,5.34

Metric,Value
Accuracy (Overall) (ratio),
Accuracy (Algebra) (ratio),
Accuracy (Counting & Probability) (ratio),
Accuracy (Geometry) (ratio),
Accuracy (Intermediate Algebra) (ratio),
Accuracy (Number Theory) (ratio),
Accuracy (Prealgebra) (ratio),
Accuracy (Precalculus) (ratio),
Accuracy Unparsed (Overall) (ratio),
Accuracy Unparsed (Algebra) (ratio),
Accuracy Unparsed (Counting & Probability) (ratio),
Accuracy Unparsed (Geometry) (ratio),
Accuracy Unparsed (Intermediate Algebra) (ratio),
Accuracy Unparsed (Number Theory) (ratio),
Accuracy Unparsed (Prealgebra) (ratio),
Accuracy Unparsed (Precalculus) (ratio),
Benchmark Duration (sec),454.16
OSL Mismatch Count,100.00
Output Token Throughput (tokens/sec),241.05
Request Count,100.00
Request Throughput (requests/sec),0.22
Total Input Sequence Length (tokens),6240.00
Total Output Sequence Length (tokens),109475.00
Total Output Tokens (tokens),109475.00
Total Token Throughput (tokens/sec),254.79


Endpoint,GPU_Index,GPU_Name,GPU_UUID,Metric,avg,min,max,sum,p1,p5,p10,p25,p50,p75,p90,p95,p99,std
